{
  "schema_version": "apg.maintenance-ledger/v1",
  "release": "v0.11",
  "owner_phase": "APG139",
  "triggers": [
    {
      "trigger_id": "APGR-CXT-BUDGET-COMPRESSION",
      "owner": "APGR",
      "source_authority": [
        "docs/v0-10-backlog-consolidation.md",
        "docs/adr/2026/09/0053-v0-10-discovery-capacity-and-svg.md"
      ],
      "refresh_condition": "Exhaustion of ADR 0053 capacity ceiling (11,507 bytes) or explicit operator rejection of reservation model",
      "repair_condition": "Semantic discovery parity tests demonstrating no loss of routing precision across benchmark queries",
      "current_state": "FALSE",
      "state_evidence": [
        "docs/adr/2026/09/0055-v0-11-capacity-and-closure-governance.md",
        "docs/governance/maintenance/apg142/context-compression.md"
      ],
      "interpretation": "APG142 supplied independent review supports the bounded FALSE finding. Fresh maintained measurement gives 11,142 UTF-8 description bytes below the unchanged 11,507 ceiling for 45 leaves; the assignment retains the reservation model. Neither accepted branch fires. ADR 0055 status reconciliation remains V0110-F work; no compression or capacity change occurs.",
      "affected_behavior": "Semantic compression of the current 45 skill descriptions; the historical APG126 estimate covered 39 descriptions and targeted 1,200\u20132,000 reclaimed bytes, not a current compression requirement.",
      "blocks_stable": false,
      "evidence_required": [
        "Exhaustion of ADR 0053 capacity ceiling (11,507 bytes) or explicit operator rejection of reservation model",
        "Semantic discovery parity tests demonstrating no loss of routing precision across benchmark queries"
      ],
      "refresh_procedure": "Evaluate the exact recorded condition using current source-bound evidence; document the decision before repair or roadmap closure.",
      "affected_skills": []
    },
    {
      "trigger_id": "APGR-REPORT-PUREGO-GIT",
      "owner": "APGR",
      "source_authority": [
        "docs/v0-10-backlog-consolidation.md",
        "docs/architecture/v0-7-embeddable-toolkit.md"
      ],
      "refresh_condition": "Only triggered if an environment strictly prohibits subprocess execution or Git CLI binary availability.",
      "repair_condition": "Bit-for-bit parity with Git CLI diffs without launching subprocesses",
      "current_state": "FALSE",
      "state_evidence": [
        "docs/governance/maintenance/apg142/purego-git.md"
      ],
      "interpretation": "APG142 supplied independent review supports the bounded FALSE finding. The supported APG-JACA reporting contract expressly permits native Git subprocesses and current development operations use Git. No exact prohibition is observed in that bounded scope; no universal consumer-runtime claim or backend repair is made.",
      "affected_behavior": "Replacement of internal Git CLI exec in `report.Service` with in-process pure-Go Git object reading",
      "blocks_stable": false,
      "evidence_required": [
        "Demonstrated inadequacy, security defect, or platform restriction of sanitized `git` CLI subprocess invocation",
        "Bit-for-bit parity with Git CLI diffs without launching subprocesses"
      ],
      "refresh_procedure": "Evaluate the exact recorded condition using current source-bound evidence; document the decision before repair or roadmap closure.",
      "affected_skills": []
    },
    {
      "trigger_id": "CSS-QD-001",
      "owner": "CSS profile maintainers",
      "source_authority": [
        "docs/governance/language-profile-known-debt.json"
      ],
      "refresh_condition": "TARGET-007 purpose, source IDs, target identity, or source registry changes",
      "repair_condition": "Introduce a compact independent source-purpose binding when future TARGET-007 maintenance justifies it.",
      "current_state": "FALSE",
      "state_evidence": [
        "docs/governance/maintenance/apg142/css-qd-001.md"
      ],
      "interpretation": "APG142 supplied independent review supports the bounded FALSE finding. Public APG77D target-first manifest, scenario fixture and candidate/retention contracts preserve TARGET-007 purpose, source IDs, target identity and source-registry semantics. Later lifecycle metadata does not change those named inputs. Active stable-blocking debt remains.",
      "affected_behavior": "qualification machinery only",
      "blocks_stable": true,
      "evidence_required": [
        "Treat compact-v3 source validation as supporting evidence only and require explicit primary-source and non-author review for any TARGET-007 authority change."
      ],
      "refresh_procedure": "Introduce a compact independent source-purpose binding when future TARGET-007 maintenance justifies it. Refresh only under the named condition and preserve historical evidence.",
      "affected_skills": [
        "css-language-profile"
      ]
    },
    {
      "trigger_id": "CSS-QD-002",
      "owner": "CSS profile maintainers",
      "source_authority": [
        "docs/governance/language-profile-known-debt.json"
      ],
      "refresh_condition": "Lane N, Lane T2, compact v3, Selection, or Response changes",
      "repair_condition": "Add an independently frozen disagreement index if the lane mechanism becomes current authority again.",
      "current_state": "FALSE",
      "state_evidence": [
        "docs/governance/maintenance/apg142/css-qd-002.md"
      ],
      "interpretation": "APG142 supplied independent review supports the bounded FALSE finding. Public APG77D scenario and retention contracts preserve the closed Selection/Response vocabularies and compact authority. Supporting private lane/compact comparisons observe no Lane N, Lane T2 or compact v3 change; those complete private vectors are not publicly reproducible here. The exact refresh is FALSE, independently of the narrower disagreement-index repair threshold. Active stable-blocking debt remains.",
      "affected_behavior": "qualification machinery only",
      "blocks_stable": true,
      "evidence_required": [
        "Do not treat adjudication count alone as proof of complete disagreement coverage; require fresh human comparison for lane or compact-row changes."
      ],
      "refresh_procedure": "Add an independently frozen disagreement index if the lane mechanism becomes current authority again. Refresh only under the named condition and preserve historical evidence.",
      "affected_skills": [
        "css-language-profile"
      ]
    },
    {
      "trigger_id": "CSS-QD-003",
      "owner": "CSS profile maintainers",
      "source_authority": [
        "docs/governance/language-profile-known-debt.json"
      ],
      "refresh_condition": "Adjudication, source registry, purpose, or authority changes",
      "repair_condition": "Add a bounded row/source relation only when a real maintenance workflow needs machine generation or automatic adjudication.",
      "current_state": "FALSE",
      "state_evidence": [
        "docs/governance/maintenance/apg142/css-qd-003.md"
      ],
      "interpretation": "APG142 supplied independent review supports the bounded FALSE finding. Public APG77D target-first registry, scenario fixture and retention/candidate contracts preserve source, purpose and adjudication authority; lifecycle annotations do not revise it. Private purpose/compact comparisons support the unchanged named rows with limited public reproducibility. The refresh is FALSE independently of machine-generation or automatic-adjudication need. Active stable-blocking debt remains.",
      "affected_behavior": "qualification machinery only",
      "blocks_stable": true,
      "evidence_required": [
        "Require row-specific non-author review for every changed adjudication source."
      ],
      "refresh_procedure": "Add a bounded row/source relation only when a real maintenance workflow needs machine generation or automatic adjudication. Refresh only under the named condition and preserve historical evidence.",
      "affected_skills": [
        "css-language-profile"
      ]
    },
    {
      "trigger_id": "CSS-QD-004",
      "owner": "CSS profile maintainers",
      "source_authority": [
        "docs/governance/language-profile-known-debt.json"
      ],
      "refresh_condition": "Route owner, decision scope, stop state, or obligation schema changes",
      "repair_condition": "Add the invariant during the next material route-schema revision.",
      "current_state": "FALSE",
      "state_evidence": [
        "docs/governance/maintenance/apg142/css-qd-004.md"
      ],
      "interpretation": "APG142 supplied independent review supports the bounded FALSE finding. The preserved public CSS retention contract and route vocabulary retain owner, decision scope, stop state and obligation schema. No CSS route-schema revision occurred; unrelated governance and hotspot schemas do not change that authority. Active stable-blocking debt remains.",
      "affected_behavior": "qualification machinery only",
      "blocks_stable": true,
      "evidence_required": [
        "Inspect owner and decision scope independently of obligation ID whenever route rows change."
      ],
      "refresh_procedure": "Add the invariant during the next material route-schema revision. Refresh only under the named condition and preserve historical evidence.",
      "affected_skills": [
        "css-language-profile"
      ]
    },
    {
      "trigger_id": "CSS-QD-005",
      "owner": "CSS profile maintainers",
      "source_authority": [
        "docs/governance/language-profile-known-debt.json"
      ],
      "refresh_condition": "Compact schema revision",
      "repair_condition": "Remove the arrays during a future compatible compact-schema revision.",
      "current_state": "FALSE",
      "state_evidence": [
        "docs/governance/maintenance/apg142/css-qd-005.md"
      ],